,Dictionary,term,term preproc,PoS,sense,Dir,Synset,Definition,Examples,Antonyms,New_Example
409,Politics,unconventional,unconventional,ADJECTIVE,1,low,unconventional.a.01,not conforming to accepted rules or standards,her unconventional dress and hair style,conventional.a.01,
410,Politics,unconventional,unconventional,ADJECTIVE,2,low,unconventional.a.02,not conventional or conformist,unconventional life styles,conventional.a.01,
411,Politics,alternative,alternative,ADJECTIVE,3,low,alternative.s.03,pertaining to unconventional choices,an alternative life style,,
413,Politics,conservative,conservative,ADJECTIVE,1,high,conservative.a.01,resistant to change,,liberal.a.03,they were very conservative in their outlook
414,Politics,conservative,conservative,ADJECTIVE,2,high,conservative.s.02,having social or political views favoring conservatism,,,they were very conservative in their outlook
416,Politics,liberal,liberal,ADJECTIVE,1,low,broad.s.08,showing or characterized by broad-mindedness,a broad political stance,,
417,Politics,liberal,liberal,ADJECTIVE,2,low,liberal.s.02,having political or social views favoring reform and progress,,,they have liberal views on divorce
418,Politics,liberal,liberal,ADJECTIVE,3,low,liberal.a.03,"tolerant of change; not bound by authoritarianism, orthodoxy, or tradition",,conservative.a.01,they have liberal views on divorce
422,Politics,progressive,progressive,ADJECTIVE,1,low,progressive.a.01,favoring or promoting progress,progressive schools,regressive.a.02,
423,Politics,progressive,progressive,ADJECTIVE,2,low,progressive.s.02,favoring or promoting reform (often by government action),,,a progressive decline in popularity
424,Politics,narrow-minded,narrowminded,ADJECTIVE,2,high,narrow-minded.a.02,lacking tolerance or flexibility or breadth of view,a brilliant but narrow-minded judge,broad-minded.a.02,
425,Politics,narrow-minded,narrowminded,ADJECTIVE,3,high,narrow-minded.s.03,rigidly adhering to a particular sect or its doctrines,,,it would be narrow-minded not to welcome these developments
426,Politics,open-minded,openminded,ADJECTIVE,1,low,open-minded.s.01,ready to entertain new ideas,an open-minded curiosity,,
