,Dictionary,term,term preproc,PoS,sense,Dir,Synset,Definition,Examples,Antonyms,New_Example
2,Sociability,sociable,sociable,ADJECTIVE,1,high,sociable.a.01,inclined to or conducive to companionship with others,a sociable occasion,unsociable.a.01,
3,Sociability,unsociable,unsociable,ADJECTIVE,1,low,unsociable.a.01,not inclined to society or companionship,an unsociable nature...shy and reserved,sociable.a.01,
8,Sociability,friendly,friendly,ADJECTIVE,1,high,friendly.a.01,characteristic of or befitting a friend,friendly advice,unfriendly.a.02,
9,Sociability,friendly,friendly,ADJECTIVE,2,high,friendly.s.02,inclined to help or support; not antagonistic or hostile,a government friendly to our interests,,
10,Sociability,unfriendly,unfriendly,ADJECTIVE,2,low,unfriendly.a.02,not disposed to friendship or friendliness,an unfriendly coldness of manner,friendly.a.01,
11,Sociability,unfriendly,unfriendly,ADJECTIVE,3,low,unfriendly.s.03,not friendly,an unfriendly act of aggression,,
12,Sociability,cold,cold,ADJECTIVE,2,low,cold.a.02,extended meanings; especially of psychological coldness; without human warmth or emotion,a cold unfriendly nod,hot.a.03,
14,Sociability,warm,warm,ADJECTIVE,2,high,warm.a.02,psychologically warm; friendly and responsive,a warm greeting,cool.a.04,
17,Sociability,likable,likable,ADJECTIVE,1,high,sympathetic.a.04,(of characters in literature or drama) evoking empathic or sympathetic feelings,the sympathetic characters in the play,unsympathetic.a.02,
18,Sociability,likable,likable,ADJECTIVE,2,high,likable.s.02,easy to like; agreeable,an attractive and likable young man,,
19,Sociability,repellent,repellent,ADJECTIVE,1,low,rebarbative.s.01,serving or tending to repel,he became rebarbative and prickly and spiteful,,
20,Sociability,pleasant,pleasant,ADJECTIVE,2,high,pleasant.s.02,(of persons) having pleasing manners or behavior,I didn't enjoy it and probably wasn't a pleasant person to be around,,
21,Sociability,unpleasant,unpleasant,ADJECTIVE,1,low,unpleasant.a.01,"disagreeable to the senses, to the mind, or feelings",an unpleasant personality,pleasant.a.01,
22,Sociability,unlikable,unlikable,ADJECTIVE,1,low,unsympathetic.a.02,(of characters in literature or drama) tending to evoke antipathetic feelings,all the characters were peculiarly unsympathetic,sympathetic.a.04,
23,Sociability,unlikable,unlikable,ADJECTIVE,2,low,unlikable.s.02,difficult or impossible to like,a disagreeable and unlikable old woman,,
24,Sociability,liked,liked,ADJECTIVE,1,high,liked.a.01,found pleasant or attractive; often used as a combining form,a well-liked teacher,disliked.a.01,
25,Sociability,disliked,disliked,ADJECTIVE,1,low,disliked.a.01,regarded with aversion,he was intensely disliked,liked.a.01,
26,Sociability,outgoing,outgoing,ADJECTIVE,3,high,extroverted.s.02,at ease in talking to others,,,she's always been very outgoing and she's got heaps of friends
27,Sociability,shy,shy,ADJECTIVE,1,low,diffident.a.02,lacking self-confidence,stood in the doorway diffident and abashed,confident.a.01,
28,Sociability,sensitive,sensitive,ADJECTIVE,2,high,sensitive.a.02,"being susceptible to the attitudes, feelings, or circumstances of others",sensitive to the local community and its needs,insensitive.a.02,
29,Sociability,insensitive,insensitive,ADJECTIVE,2,low,insensitive.a.02,deficient in human sensibility; not mentally or morally sensitive,insensitive to the needs of the patients,sensitive.a.02,
30,Sociability,affectionate,affectionate,ADJECTIVE,1,high,affectionate.s.01,having or displaying warmth or affection,affectionate children,,
31,Sociability,unaffectionate,unaffectionate,ADJECTIVE,1,low,detached.s.05,lacking affection or warm feeling,an uncaring person,,
32,Sociability,distant,distant,ADJECTIVE,3,low,aloof.s.01,remote in manner,stood apart with aloof dignity,,
33,Sociability,unreserved,unreserved,ADJECTIVE,2,high,unreserved.a.02,not cautious or reticent,unreserved behavior,reserved.a.02,
34,Sociability,open,open,ADJECTIVE,20,high,candid.s.03,openly straightforward and direct without reserve or secretiveness,his candid eyes,,
35,Sociability,caring,caring,ADJECTIVE,1,high,caring.s.01,feeling and exhibiting concern and empathy for others,caring friends,,
36,Sociability,uncaring,uncaring,ADJECTIVE,1,low,detached.s.05,lacking affection or warm feeling,an uncaring person,,
37,Sociability,sympathetic,sympathetic,ADJECTIVE,2,high,sympathetic.a.02,expressing or feeling or resulting from sympathy or compassion or friendly fellow feelings; disposed toward,sympathetic to the students' cause,unsympathetic.a.01,
38,Sociability,sympathetic,sympathetic,ADJECTIVE,3,high,charitable.s.03,showing or motivated by sympathy and understanding and generosity,was charitable in his opinions of others,,
39,Sociability,sympathetic,sympathetic,ADJECTIVE,4,high,sympathetic.a.04,(of characters in literature or drama) evoking empathic or sympathetic feelings,the sympathetic characters in the play,unsympathetic.a.02,
40,Sociability,unsympathetic,unsympathetic,ADJECTIVE,2,low,unsympathetic.a.02,(of characters in literature or drama) tending to evoke antipathetic feelings,all the characters were peculiarly unsympathetic,sympathetic.a.04,
41,Sociability,unsympathetic,unsympathetic,ADJECTIVE,4,low,unkindly.s.01,lacking in sympathy and kindness,unkindly ancts,,
43,Sociability,helpful,helpful,ADJECTIVE,1,high,helpful.a.01,providing assistance or serving a useful function,,unhelpful.a.01,people are friendly and helpful
44,Sociability,unhelpful,unhelpful,ADJECTIVE,1,low,unhelpful.a.01,providing no assistance,,helpful.a.01,several complained that the staff were unhelpful
45,Sociability,understanding,understanding,ADJECTIVE,1,high,understanding.s.01,characterized by understanding based on comprehension and discernment and empathy,an understanding friend,,
46,Sociability,supportive,supportive,ADJECTIVE,1,high,supportive.a.01,furnishing support or assistance,a supportive family network,unsupportive.a.01,
47,Sociability,unsupportive,unsupportive,ADJECTIVE,1,low,unsupportive.a.01,not furnishing support or assistance,,supportive.a.01,the family environment is unsupportive
48,Sociability,polite,polite,ADJECTIVE,1,high,polite.a.01,"showing regard for others in manners, speech, behavior, etc.",,impolite.a.01,they thought she was wrong but were too polite to say so
49,Sociability,impolite,impolite,ADJECTIVE,1,low,impolite.a.01,not polite,,polite.a.01,it would have been impolite to refuse
50,Sociability,aloof,aloof,ADJECTIVE,1,low,aloof.s.01,remote in manner,stood apart with aloof dignity,,
51,Sociability,civil,civil,ADJECTIVE,2,high,civil.a.02,not rude; marked by satisfactory (or especially minimal) adherence to social usages and sufficient but not noteworthy consideration for others; - W.S. Maugham,even if he didn't like them he should have been civil,uncivil.a.01,
52,Sociability,rude,rude,ADJECTIVE,1,low,ill-mannered.s.01,socially incorrect in behavior,resentment flared at such an unmannered intrusion,,
53,Sociability,antisocial,antisocial,ADJECTIVE,1,low,antisocial.s.01,shunning contact with others,standoffish and antisocial,,
54,Sociability,antisocial,antisocial,ADJECTIVE,2,low,antisocial.s.02,hostile to or disruptive of normal standards of social behavior,criminal behavior or conduct that violates the rights of other individuals is antisocial,,
55,Sociability,social,social,ADJECTIVE,4,high,social.s.04,composed of sociable people or formed for the purpose of sociability,a purely social club,,
56,Sociability,social,social,ADJECTIVE,5,high,social.s.05,tending to move or live together in groups or colonies of the same kind,ants are social insects,,
57,Sociability,social,social,ADJECTIVE,6,high,social.s.06,marked by friendly companionship with others,a social cup of coffee,,
58,Sociability,unsocial,unsocial,ADJECTIVE,1,low,unsocial.a.01,not seeking or given to association; being or living without companions,the unsocial disposition to neglect one's neighbors,social.a.02,
59,Sociability,asocial,asocial,ADJECTIVE,1,low,asocial.s.01,given to avoiding association with others,bears are asocial secretive animals,,
60,Sociability,asocial,asocial,ADJECTIVE,2,low,antisocial.s.02,hostile to or disruptive of normal standards of social behavior,criminal behavior or conduct that violates the rights of other individuals is antisocial,,
61,Sociability,humorous,humorou,ADJECTIVE,1,high,humorous.a.01,full of or characterized by humor,humorous stories,humorless.a.01,
62,Sociability,funny,funny,ADJECTIVE,1,high,amusing.s.02,arousing or provoking laughter,an amusing film with a steady stream of pranks and pratfalls,,
63,Sociability,boring,boring,ADJECTIVE,1,low,boring.s.01,so lacking in interest as to cause mental weariness; ; ; ; ; ; - Edmund Burke; ; - Mark Twain,a boring evening with uninteresting people,,
64,Sociability,popular,popular,ADJECTIVE,1,high,popular.a.01,"regarded with great favor, approval, or affection especially by the general public",a popular tourist attraction,unpopular.a.01,
65,Sociability,unpopular,unpopular,ADJECTIVE,1,low,unpopular.a.01,regarded with disfavor or lacking general approval,unpopular ideas,popular.a.01,
66,Sociability,nice,nice,ADJECTIVE,1,high,nice.a.01,pleasant or pleasing or agreeable in nature or appearance; - George Meredith,what a nice fellow you are and we all thought you so nasty,nasty.a.01,
67,Sociability,nasty,nasty,ADJECTIVE,1,low,nasty.a.01,offensive or even (of persons) malicious; ; ; ; ; ; - Ezra Pound,in a nasty mood,nice.a.01,
68,Sociability,sentimental,sentimental,ADJECTIVE,1,high,sentimental.s.01,given to or marked by sentiment or sentimentality,,,she felt a sentimental attachment to the place creep over her
69,Sociability,forthcoming,forthcoming,ADJECTIVE,1,high,extroverted.s.02,at ease in talking to others,,,the forthcoming cricket season
70,Sociability,tender,tender,ADJECTIVE,1,high,tender.a.01,given to sympathy or gentleness or sentimentality,a tender heart,tough.a.01,
71,Sociability,tender,tender,ADJECTIVE,3,high,tender.s.03,young and immature,at a tender age,,
72,Sociability,agreeable,agreeable,ADJECTIVE,1,high,agreeable.a.01,conforming to your own liking or feelings or nature; ; ; - Disraeli,Is the plan agreeable to you?,disagreeable.a.01,
73,Sociability,disagreeable,disagreeable,ADJECTIVE,2,low,disagreeable.s.02,unpleasant to interact with,a disagreeable old man,,
74,Sociability,rough,rough,ADJECTIVE,2,low,rough.s.02,(of persons or behavior) lacking refinement or finesse,she was a diamond in the rough,,
75,Sociability,rough,rough,ADJECTIVE,7,low,pugnacious.s.02,ready and able to resort to force or violence; - Herman Melville,pugnacious spirits...lamented that there was so little prospect of an exhilarating disturbance,,
76,Sociability,rough,rough,ADJECTIVE,13,low,harsh.s.01,unpleasantly stern,wild and harsh country full of hot sand and cactus,,
77,Sociability,rough,rough,ADJECTIVE,14,low,harsh.s.04,unkind or cruel or uncivil,had harsh words,,
78,Sociability,welcoming,welcoming,ADJECTIVE,1,high,welcoming.s.01,very cordial,a welcoming smile,,
79,Sociability,inhospitable,inhospitable,ADJECTIVE,2,low,inhospitable.a.02,not hospitable,they are extremely inhospitable these days,hospitable.a.02,
80,Sociability,hospitable,hospitable,ADJECTIVE,2,high,hospitable.a.02,disposed to treat guests and strangers with cordiality and generosity,a good-natured and hospitable man,inhospitable.a.02,
81,Sociability,thoughtful,thoughtful,ADJECTIVE,5,high,thoughtful.s.05,considerate of the feelings or well-being of others,,,brows drawn together in thoughtful consideration
82,Sociability,inconsiderate,inconsiderate,ADJECTIVE,1,low,inconsiderate.a.01,lacking regard for the rights or feelings of others,shockingly inconsiderate behavior,considerate.a.01,
83,Sociability,timid,timid,ADJECTIVE,1,low,timid.a.01,showing fear and lack of confidence,,bold.a.01,I was too timid to ask for what I wanted
84,Sociability,timid,timid,ADJECTIVE,2,low,diffident.a.02,lacking self-confidence,stood in the doorway diffident and abashed,confident.a.01,
87,Morality,moral,moral,ADJECTIVE,1,high,moral.a.01,concerned with principles of right and wrong or conforming to standards of behavior and character based on those principles,moral sense,immoral.a.01,
88,Morality,immoral,immoral,ADJECTIVE,1,low,immoral.a.01,deliberately violating accepted principles of right and wrong,,moral.a.01,unseemly and immoral behaviour
89,Morality,immoral,immoral,ADJECTIVE,2,low,base.s.04,not adhering to ethical or moral principles,base and unpatriotic motives,,
91,Morality,trustworthy,trustworthy,ADJECTIVE,1,high,trustworthy.a.01,worthy of trust or belief,a trustworthy report,untrustworthy.a.01,
93,Morality,untrustworthy,untrustworthy,ADJECTIVE,1,low,untrustworthy.a.01,not worthy of trust or belief,an untrustworthy person,trustworthy.a.01,
94,Morality,sincere,sincere,ADJECTIVE,1,high,sincere.a.01,open and genuine; not deceitful,"he was a good man, decent and sincere",insincere.a.01,
95,Morality,insincere,insincere,ADJECTIVE,1,low,insincere.a.01,lacking sincerity,a charming but thoroughly insincere woman,sincere.a.01,
96,Morality,honest,honest,ADJECTIVE,1,high,honest.a.01,not disposed to cheat or defraud; not deceptive or fraudulent,honest lawyers,dishonest.a.01,
97,Morality,honest,honest,ADJECTIVE,2,high,honest.s.02,without dissimulation; frank,my honest opinion,,
98,Morality,honest,honest,ADJECTIVE,3,high,dependable.s.02,worthy of being depended on,a dependable worker,,
99,Morality,dishonest,dishonest,ADJECTIVE,1,low,dishonest.a.01,deceptive or fraudulent; disposed to cheat or defraud or deceive,,honest.a.01,he was a dishonest hypocrite prepared to exploit his family
100,Morality,dishonest,dishonest,ADJECTIVE,2,low,corruptible.s.01,capable of being corrupted,corruptible judges,,
101,Morality,egoistic,egoistic,ADJECTIVE,1,low,egoistic.a.01,limited to or caring only about yourself and your own needs,,altruistic.a.01,
102,Morality,altruistic,altruistic,ADJECTIVE,1,high,altruistic.a.01,showing unselfish concern for the welfare of others,,egoistic.a.01,it was an entirely altruistic act
103,Morality,selfish,selfish,ADJECTIVE,1,low,selfish.a.01,concerned chiefly or only with yourself and your advantage to the exclusion of others; - Maria Weston Chapman,Selfish men were...trying to make capital for themselves out of the sacred cause of civil rights,unselfish.a.01,
104,Morality,selfless,selfles,ADJECTIVE,1,high,altruistic.a.01,showing unselfish concern for the welfare of others,,egoistic.a.01,an act of selfless devotion
105,Morality,benevolent,benevolent,ADJECTIVE,1,high,benevolent.a.01,intending or showing kindness,a benevolent society,,
106,Morality,benevolent,benevolent,ADJECTIVE,2,high,charitable.s.03,showing or motivated by sympathy and understanding and generosity,was charitable in his opinions of others,,
107,Morality,benevolent,benevolent,ADJECTIVE,3,high,benevolent.s.03,generous in providing aid to others,,,he was something of a benevolent despot
108,Morality,benevolent,benevolent,ADJECTIVE,4,high,beneficent.s.02,generous in assistance to the poor,a benevolent contributor,,
111,Morality,hardhearted,hardhearted,ADJECTIVE,1,low,hardhearted.a.01,lacking in feeling or pity or warmth,,softhearted.a.01,
112,Morality,hardhearted,hardhearted,ADJECTIVE,2,low,hardhearted.s.02,devoid of feeling for others,an unfeeling wretch,,
113,Morality,softhearted,softhearted,ADJECTIVE,1,high,softhearted.a.01,easily moved to pity or sorrow,a softhearted judge,hardhearted.a.01,
114,Morality,loyal,loyal,ADJECTIVE,1,high,loyal.a.01,steadfast in allegiance or duty,loyal subjects,disloyal.a.02,
115,Morality,disloyal,disloyal,ADJECTIVE,2,low,disloyal.a.02,deserting your allegiance or duty to leader or cause or principle,disloyal aides revealed his indiscretions to the papers,loyal.a.01,
116,Morality,fair,fair,ADJECTIVE,1,high,fair.a.01,free from favoritism or self-interest or bias or deception; conforming with established standards or rules,a fair referee,unfair.a.01,
117,Morality,unfair,unfair,ADJECTIVE,1,low,unfair.a.01,not fair; marked by injustice or partiality or deception,used unfair methods,fair.a.01,
118,Morality,tolerant,tolerant,ADJECTIVE,1,high,tolerant.a.01,showing respect for the rights or opinions or practices of others,,intolerant.a.01,we must be tolerant of others
119,Morality,tolerant,tolerant,ADJECTIVE,2,high,kind.s.03,tolerant and forgiving under provocation,our neighbor was very kind about the window our son broke,,
120,Morality,intolerant,intolerant,ADJECTIVE,1,low,intolerant.a.01,unwilling to tolerate difference of opinion,,tolerant.a.01,as a society we are more intolerant of certain types of violence than we were in the past
123,Morality,good,good,ADJECTIVE,3,high,good.a.03,morally admirable,,evil.a.01,it's good that he's back to his old self
124,Morality,bad,bad,ADJECTIVE,1,low,bad.a.01,having undesirable or negative qualities,a bad report card,good.a.01,
125,Morality,virtuous,virtuou,ADJECTIVE,1,high,virtuous.a.01,morally excellent,,wicked.a.01,she considered herself very virtuous because she neither drank nor smoked
126,Morality,kind,kind,ADJECTIVE,1,high,kind.a.01,having or showing a tender and considerate and helpful nature; used especially of persons and their behavior,kind to sick patients,unkind.a.01,
127,Morality,unkind,unkind,ADJECTIVE,1,low,unkind.a.01,lacking kindness,a thoughtless and unkind remark,kind.a.01,
128,Morality,unkind,unkind,ADJECTIVE,2,low,pitiless.s.02,deficient in humane and kindly feelings,,,you were terribly unkind to her
129,Morality,right,right,ADJECTIVE,3,high,correct.s.02,socially right or correct,it isn't right to leave the party without saying goodbye,,
130,Morality,right,right,ADJECTIVE,4,high,right.a.04,in conformance with justice or law or morality,do the right thing and confess,wrong.a.02,
131,Morality,wrong,wrong,ADJECTIVE,2,low,wrong.a.02,contrary to conscience or morality or law,it is wrong for the rich to take advantage of the poor,right.a.04,
132,Morality,mean,mean,ADJECTIVE,2,low,hateful.s.02,characterized by malice,a hateful thing to do,,
133,Morality,mean,mean,ADJECTIVE,3,low,base.s.05,having or showing an ignoble lack of honor or morality; - Edmund Burke; ; - Shakespeare,that liberal obedience without which your army would be a base rabble,,
137,Morality,honorable,honorable,ADJECTIVE,1,high,honest.a.01,not disposed to cheat or defraud; not deceptive or fraudulent,honest lawyers,dishonest.a.01,
138,Morality,honorable,honorable,ADJECTIVE,3,high,ethical.s.03,adhering to ethical and moral principles,it seems ethical and right,,
139,Morality,dishonorable,dishonorable,ADJECTIVE,1,low,dishonorable.a.01,lacking honor or integrity; deserving dishonor,dishonorable in thought and deed,honorable.a.02,
140,Morality,dishonorable,dishonorable,ADJECTIVE,2,low,dishonest.a.01,deceptive or fraudulent; disposed to cheat or defraud or deceive,,honest.a.01,
141,Morality,corrupt,corrupt,ADJECTIVE,1,low,corrupt.a.01,lacking in integrity,humanity they knew to be corrupt...from the day of Adam's creation,incorrupt.a.01,
142,Morality,corrupt,corrupt,ADJECTIVE,2,low,crooked.a.02,not straight; dishonest or immoral or evasive,,straight.a.06,unscrupulous logging companies assisted by corrupt officials
143,Morality,incorrupt,incorrupt,ADJECTIVE,1,high,incorrupt.a.01,free of corruption or immorality,a policeman who was incorrupt and incorruptible,corrupt.a.01,
145,Morality,criminal,criminal,ADJECTIVE,1,low,condemnable.s.01,bringing or deserving severe rebuke or censure,a criminal waste of talent,,
146,Morality,criminal,criminal,ADJECTIVE,2,low,criminal.s.02,guilty of crime or serious offense,criminal in the sight of God and man,,
147,Morality,criminal,criminal,ADJECTIVE,3,low,criminal.s.03,involving or being or having the nature of a crime,a criminal offense,,
148,Morality,innocent,innocent,ADJECTIVE,1,high,innocent.a.01,free from evil or guilt,an innocent child,guilty.a.01,
151,Morality,hostile,hostile,ADJECTIVE,1,low,hostile.a.01,characterized by enmity or ill will,a hostile nation,amicable.a.01,
152,Morality,amicable,amicable,ADJECTIVE,1,high,amicable.a.01,characterized by friendship and good will,,hostile.a.01,an amicable settlement of the dispute
153,Morality,fake,fake,ADJECTIVE,1,low,bogus.s.01,fraudulent; having a misleading appearance,,,she got on the plane with a fake passport
154,Morality,genuine,genuine,ADJECTIVE,2,high,genuine.s.02,not pretended; sincerely felt or expressed,genuine emotion,,
155,Morality,double-faced,doublefaced,ADJECTIVE,2,low,ambidextrous.s.02,marked by deliberate deceptiveness especially by pretending one set of feelings and acting under the influence of another; - Israel Zangwill; ; - W.M.Thackeray,she was a deceitful scheming little thing,,
156,Morality,cunning,cunning,ADJECTIVE,2,low,crafty.s.01,marked by skill in deception,cunning men often pass for wise,,
157,Morality,humane,humane,ADJECTIVE,2,high,humane.a.02,marked or motivated by concern with the alleviation of suffering,,inhumane.a.01,regulations ensuring the humane treatment of animals
158,Morality,vicious,viciou,ADJECTIVE,1,low,barbarous.s.01,(of persons or their actions) able or disposed to inflict pain or suffering,a barbarous crime,,
159,Morality,vicious,viciou,ADJECTIVE,2,low,evil.s.02,having the nature of vice,,,a vicious assault
160,Morality,vicious,viciou,ADJECTIVE,3,low,condemnable.s.01,bringing or deserving severe rebuke or censure,a criminal waste of talent,,
161,Morality,scheming,scheming,ADJECTIVE,1,low,calculating.s.01,used of persons,the most calculating and selfish men in the community,,
162,Morality,revengeful,revengeful,ADJECTIVE,1,low,revengeful.s.01,disposed to seek revenge or intended for revenge; - Shakespeare; - M.R.Cohen,more vindictive than jealous love,,
163,Morality,treacherous,treacherou,ADJECTIVE,2,low,punic.s.02,tending to betray; especially having a treacherous character as attributed to the Carthaginians by the Romans,Punic faith,,
164,Morality,faithful,faithful,ADJECTIVE,1,high,faithful.a.01,steadfast in affection or allegiance,years of faithful service,unfaithful.a.01,
165,Morality,exploitative,exploitative,ADJECTIVE,1,low,exploitative.s.01,tending to exploit or make use of,,,an exploitative form of labour
166,Morality,stingy,stingy,ADJECTIVE,1,low,stingy.a.01,unwilling to spend,she practices economy without being stingy,generous.a.01,
167,Morality,brutal,brutal,ADJECTIVE,1,low,barbarous.s.01,(of persons or their actions) able or disposed to inflict pain or suffering,a barbarous crime,,
170,Morality,good-natured,goodnatured,ADJECTIVE,1,high,good-natured.a.01,having an easygoing and cheerful disposition,too good-natured to resent a little criticism,ill-natured.a.01,
171,Morality,truthful,truthful,ADJECTIVE,1,high,truthful.a.01,expressing or given to expressing the truth,a true statement,untruthful.a.01,
172,Morality,untruthful,untruthful,ADJECTIVE,1,low,untruthful.a.01,not expressing or given to expressing the truth,the statement given under oath was untruthful,truthful.a.01,
173,Morality,cooperative,cooperative,ADJECTIVE,3,high,accommodative.s.02,willing to adjust to differences in order to obtain agreement,,,every member has clearly defined tasks in a cooperative enterprise
174,Morality,uncooperative,uncooperative,ADJECTIVE,1,low,uncooperative.a.01,unwilling to cooperate,an uncooperative witness,cooperative.a.02,
175,Morality,lenient,lenient,ADJECTIVE,3,high,lenient.s.03,characterized by tolerance and mercy,,,in the view of the Court the sentence was too lenient
176,Morality,generous,generou,ADJECTIVE,1,high,generous.a.01,willing to give and share unstintingly,a generous donation,stingy.a.01,
177,Morality,forgiving,forgiving,ADJECTIVE,1,high,forgiving.a.01,inclined or able to forgive and show mercy,a kindly forgiving nature,unforgiving.a.01,
178,Morality,compassionate,compassionate,ADJECTIVE,1,high,compassionate.a.01,showing or having compassion,heard the soft and compassionate voices of women,uncompassionate.a.01,
179,Morality,unforgiving,unforgiving,ADJECTIVE,1,low,unforgiving.a.01,unwilling or unable to forgive or show mercy,a surly unforgiving old woman,forgiving.a.01,
180,Morality,resentful,resentful,ADJECTIVE,1,low,resentful.a.01,full of or marked by resentment or indignant ill will,resentful at the way he was treated,unresentful.a.01,
181,Morality,reliable,reliable,ADJECTIVE,1,high,reliable.a.01,worthy of reliance or trust,a reliable source of information,unreliable.a.02,
182,Morality,reliable,reliable,ADJECTIVE,2,high,dependable.s.02,worthy of being depended on,a dependable worker,,
183,Morality,unreliable,unreliable,ADJECTIVE,2,low,unreliable.a.02,not worthy of reliance or trust,in the early 1950s computers were large and expensive and unreliable,reliable.a.01,
184,Morality,irresponsible,irresponsible,ADJECTIVE,1,low,irresponsible.a.01,showing lack of care for consequences,behaved like an irresponsible idiot,responsible.a.01,
185,Morality,responsible,responsible,ADJECTIVE,1,high,responsible.a.01,worthy of or requiring responsibility or trust; or held accountable,a responsible adult,irresponsible.a.01,
186,Morality,prejudiced,prejudiced,ADJECTIVE,2,low,prejudiced.a.02,being biased or having a belief or attitude formed beforehand,a prejudiced judge,unprejudiced.a.01,
187,Morality,unprejudiced,unprejudiced,ADJECTIVE,1,high,unprejudiced.a.01,free from undue bias or preconceived opinions,an unprejudiced appraisal of the pros and cons,prejudiced.a.02,
188,Morality,racist,racist,ADJECTIVE,1,low,racist.s.01,based on racial intolerance,racist remarks,,
189,Morality,racist,racist,ADJECTIVE,2,low,racist.s.02,discriminatory especially on the basis of race or religion,,,we are investigating complaints about racist abuse
194,Morality,sexist,sexist,ADJECTIVE,1,low,sexist.s.01,discriminatory on the basis of sex (usually said of men's attitude toward women),,,old-fashioned sexist attitudes
195,Morality,homophobic,homophobic,ADJECTIVE,1,low,homophobic.s.01,prejudiced against homosexual people,,,homophobic remarks
